{
  "schema_version": "0.1.0",
  "record_type": "TruthCoverage",
  "document_status": "draft",
  "payload": {
    "coverage_id": null,
    "target": null,
    "availability": null,
    "evidence_origin": null,
    "provenance_refs": null,
    "label_semantics": null,
    "regions": null,
    "outside_regions_policy": null,
    "independence": null,
    "limitations": null
  },
  "unresolved_items": [
    {
      "field": "/payload",
      "reason": "尚未填写并核对本对象所需信息。",
      "affected_actions": [
        "字段定稿；不授予计算许可"
      ],
      "question": "请填写有来源的信息；未知字段保持待确认，不填默认值，不据空标签推断纯背景。"
    }
  ]
}
